{
  "package": "CONTACT-PUBLICATION-WINNER-READ-01",
  "decision": "DR-0124",
  "status": "FROZEN_TARGET_NOT_ACTIVE",
  "runtimeActivation": false,
  "coordinationTarget": 4,
  "outerOnionOperation": 4,
  "placementRequestKind": 8,
  "placementServiceClass": 1,
  "suite": 769,
  "requestVersion": 1,
  "requestBytes": 304,
  "unsignedRequestBytes": 240,
  "requestHeaderBytes": 8,
  "requestFieldBytes": [
    16,
    32,
    32,
    32,
    8,
    32,
    32,
    32,
    8,
    8,
    64
  ],
  "maximumRequestSeconds": 120,
  "requestSigningDomain": "Deep/ContactResolver/V2/publication-winner-read-request",
  "gatewayShardDomain": "Deep/ContactResolver/V2/publication-winner-read-gateway",
  "originalRequestHashDomain": "Deep/ContactResolver/V2/publication-winner-original-request",
  "originalRequestHashInput": "exact complete signed canonical V4 publication-authority request; not XPU hash",
  "responseVersion": 1,
  "responseOverheadBytes": 60,
  "responseMinimumBytes": 14742,
  "responseMaximumBytes": 93152,
  "originalResponseMinimumBytes": 14682,
  "originalResponseMaximumBytes": 93092,
  "endpoint": "/api/v2/contact-publication-winner",
  "requestMediaType": "application/vnd.deep.contact-publication-winner-request.v1+octet-stream",
  "responseMediaType": "application/vnd.deep.contact-publication-winner-response.v1+octet-stream",
  "publicApis": [
    "PublicationWinnerReadWireRequest",
    "DeepIdV2PublicationWinnerReadWireCodec",
    "DeepIdV2PublicationWinnerReadAuthor.AuthorRequestAsync",
    "DeepIdV2PublicationWinnerReadAuthor.VerifyIssuerRequestAsync",
    "DeepIdV2PublicationWinnerReadAuthor.VerifyOwnedResponseAsync"
  ],
  "privateJournalChange": false,
  "readOnly": true,
  "missingOrPending": "REJECT_WITHOUT_SIGNING_RESERVATION_OR_REPAIR",
  "activation": [
    "exact original request preserved",
    "fresh publisher proof/signature",
    "permanent completed winner",
    "no signer callback or count change",
    "independent owner intent verification",
    "phase5-to-phase6 atomic response adoption",
    "existing XPL and both XPO receipts",
    "retained Windows/Android"
  ]
}
